<?xml version="1.0" encoding="UTF-8"?>
<quiz xmlns="http://it.univaq.mwt.xml/quiz" 
      xmlns:xsi="http://www.w3.org/2001/XMLSchema-instance" 
      xsi:schemaLocation="http://it.univaq.mwt.xml/quiz ../schema/quizSchema.xsd">
   <serialNumber>T-FE73E20</serialNumber>
   <timestamp>2014-03-18</timestamp>
   <didacticSector>
      <sectorId>J2EE</sectorId>
      <description>Tecnologie J2EE</description>
   </didacticSector>
   <level>3</level>
   <student>
      <name>marco</name>
      <surname>di dionisio</surname>
      <idNumber>123456</idNumber>
   </student>
   <questionsList>
      <question>
         <image href="http://univaq.it/image.jpg"/>
         <text>
            Quesito 4
        </text>
         <optionsList>
            <option trueAnswer="true">TRUE</option>
            <option trueAnswer="false">FALSE3</option>
            <option trueAnswer="false">FALSE2</option>
         </optionsList>
      </question>
      <question>
         <image href="http://univaq.it/image.jpg"/>
         <text>
            Quesito 2
        </text>
         <optionsList>
            <option trueAnswer="false">FALSE1</option>
            <option trueAnswer="true">TRUE</option>
            <option trueAnswer="false">FALSE4</option>
         </optionsList>
      </question>
      <question>
         <image href="http://univaq.it/image.jpg"/>
         <text>
            Quesito 8
        </text>
         <optionsList>
            <option trueAnswer="false">FALSE8</option>
            <option trueAnswer="false">FALSE4</option>
            <option trueAnswer="true">TRUE</option>
         </optionsList>
      </question>
      <question>
         <image href="http://univaq.it/image.jpg"/>
         <text>
            Quesito 6
        </text>
         <optionsList>
            <option trueAnswer="false">FALSE7</option>
            <option trueAnswer="true">TRUE</option>
            <option trueAnswer="false">FALSE3</option>
         </optionsList>
      </question>
      <question>
         <image href="http://univaq.it/image.jpg"/>
         <text>
            Quesito 7
        </text>
         <optionsList>
            <option trueAnswer="true">TRUE</option>
            <option trueAnswer="false">FALSE4</option>
            <option trueAnswer="false">FALSE6</option>
         </optionsList>
      </question>
      <question>
         <image href="http://univaq.it/image.jpg"/>
         <text>
            Quesito 3
        </text>
         <optionsList>
            <option trueAnswer="false">FALSE3</option>
            <option trueAnswer="true">TRUE</option>
            <option trueAnswer="false">FALSE1</option>
         </optionsList>
      </question>
   </questionsList>
</quiz>